{
  "$schema": "./script-bindings.schema.json",
  "schemaVersion": 1,
  "namespace": "Axiom.Gameplay",
  "components": [
    "transform.component.json",
    "rigid-body.component.json"
  ],
  "limits": {
    "entities": 1024,
    "attachments": 32,
    "operations": 128,
    "logs": 32,
    "sourceBytes": 65536
  }
}
